[
  {
    "dataStatus": "complete",
    "entityRef": {
      "entityId": "acc_127",
      "entityType": "equipment"
    },
    "id": "acc_127",
    "itemType": "equipment",
    "linkStatus": "resolved",
    "name": "老舊的身體腰帶"
  },
  {
    "dataStatus": "complete",
    "entityRef": {
      "entityId": "acc_128",
      "entityType": "equipment"
    },
    "id": "acc_128",
    "itemType": "equipment",
    "linkStatus": "resolved",
    "name": "老舊的精神腰帶"
  },
  {
    "dataStatus": "complete",
    "entityRef": {
      "entityId": "acc_129",
      "entityType": "equipment"
    },
    "id": "acc_129",
    "itemType": "equipment",
    "linkStatus": "resolved",
    "name": "老舊的靈魂腰帶"
  },
  {
    "dataStatus": "complete",
    "entityRef": {
      "entityId": "acc_130",
      "entityType": "equipment"
    },
    "id": "acc_130",
    "itemType": "equipment",
    "linkStatus": "resolved",
    "name": "精神腰帶"
  },
  {
    "dataStatus": "complete",
    "entityRef": {
      "entityId": "acc_131",
      "entityType": "equipment"
    },
    "id": "acc_131",
    "itemType": "equipment",
    "linkStatus": "resolved",
    "name": "靈魂腰帶"
  },
  {
    "dataStatus": "complete",
    "entityRef": {
      "entityId": "acc_134",
      "entityType": "equipment"
    },
    "id": "acc_134",
    "itemType": "equipment",
    "linkStatus": "resolved",
    "name": "勇敢皮帶"
  },
  {
    "dataStatus": "complete",
    "entityRef": {
      "entityId": "acc_135",
      "entityType": "equipment"
    },
    "id": "acc_135",
    "itemType": "equipment",
    "linkStatus": "resolved",
    "name": "光明身體腰帶"
  },
  {
    "dataStatus": "complete",
    "entityRef": {
      "entityId": "acc_136",
      "entityType": "equipment"
    },
    "id": "acc_136",
    "itemType": "equipment",
    "linkStatus": "resolved",
    "name": "光明精神腰帶"
  },
  {
    "dataStatus": "complete",
    "entityRef": {
      "entityId": "acc_137",
      "entityType": "equipment"
    },
    "id": "acc_137",
    "itemType": "equipment",
    "linkStatus": "resolved",
    "name": "光明靈魂腰帶"
  },
  {
    "dataStatus": "complete",
    "entityRef": {
      "entityId": "acc_belt_earth",
      "entityType": "equipment"
    },
    "id": "acc_belt_earth",
    "itemType": "equipment",
    "linkStatus": "resolved",
    "name": "地精靈的皮帶"
  },
  {
    "dataStatus": "complete",
    "entityRef": {
      "entityId": "acc_belt_fire",
      "entityType": "equipment"
    },
    "id": "acc_belt_fire",
    "itemType": "equipment",
    "linkStatus": "resolved",
    "name": "火精靈的皮帶"
  },
  {
    "dataStatus": "complete",
    "entityRef": {
      "entityId": "acc_belt_water",
      "entityType": "equipment"
    },
    "id": "acc_belt_water",
    "itemType": "equipment",
    "linkStatus": "resolved",
    "name": "水精靈的皮帶"
  },
  {
    "dataStatus": "complete",
    "entityRef": {
      "entityId": "acc_belt_wind",
      "entityType": "equipment"
    },
    "id": "acc_belt_wind",
    "itemType": "equipment",
    "linkStatus": "resolved",
    "name": "風精靈的皮帶"
  },
  {
    "dataStatus": "complete",
    "entityRef": {
      "entityId": "acc_ear_brave",
      "entityType": "equipment"
    },
    "id": "acc_ear_brave",
    "itemType": "equipment",
    "linkStatus": "resolved",
    "name": "勇猛耳環"
  },
  {
    "dataStatus": "complete",
    "entityRef": {
      "entityId": "acc_ear_clan",
      "entityType": "equipment"
    },
    "id": "acc_ear_clan",
    "itemType": "equipment",
    "linkStatus": "resolved",
    "name": "族群耳環"
  },
  {
    "dataStatus": "complete",
    "entityRef": {
      "entityId": "acc_ear_dance",
      "entityType": "equipment"
    },
    "id": "acc_ear_dance",
    "itemType": "equipment",
    "linkStatus": "resolved",
    "name": "舞動耳環"
  },
  {
    "dataStatus": "complete",
    "entityRef": {
      "entityId": "acc_ear_dominate",
      "entityType": "equipment"
    },
    "id": "acc_ear_dominate",
    "itemType": "equipment",
    "linkStatus": "resolved",
    "name": "支配耳環"
  },
  {
    "dataStatus": "complete",
    "entityRef": {
      "entityId": "acc_ear_festival",
      "entityType": "equipment"
    },
    "id": "acc_ear_festival",
    "itemType": "equipment",
    "linkStatus": "resolved",
    "name": "慶典耳環"
  },
  {
    "dataStatus": "complete",
    "entityRef": {
      "entityId": "acc_ear_honor",
      "entityType": "equipment"
    },
    "id": "acc_ear_honor",
    "itemType": "equipment",
    "linkStatus": "resolved",
    "name": "名譽耳環"
  },
  {
    "dataStatus": "complete",
    "entityRef": {
      "entityId": "acc_ear_passion",
      "entityType": "equipment"
    },
    "id": "acc_ear_passion",
    "itemType": "equipment",
    "linkStatus": "resolved",
    "name": "熱情耳環"
  },
  {
    "dataStatus": "complete",
    "entityRef": {
      "entityId": "acc_ear_peak",
      "entityType": "equipment"
    },
    "id": "acc_ear_peak",
    "itemType": "equipment",
    "linkStatus": "resolved",
    "name": "絕頂耳環"
  },
  {
    "dataStatus": "complete",
    "entityRef": {
      "entityId": "acc_ear_phantom",
      "entityType": "equipment"
    },
    "id": "acc_ear_phantom",
    "itemType": "equipment",
    "linkStatus": "resolved",
    "name": "幻魔耳環"
  },
  {
    "dataStatus": "complete",
    "entityRef": {
      "entityId": "acc_ear_rage",
      "entityType": "equipment"
    },
    "id": "acc_ear_rage",
    "itemType": "equipment",
    "linkStatus": "resolved",
    "name": "憤怒耳環"
  },
  {
    "dataStatus": "complete",
    "entityRef": {
      "entityId": "acc_ear_rampage",
      "entityType": "equipment"
    },
    "id": "acc_ear_rampage",
    "itemType": "equipment",
    "linkStatus": "resolved",
    "name": "暴走耳環"
  },
  {
    "dataStatus": "complete",
    "entityRef": {
      "entityId": "acc_ear_slave",
      "entityType": "equipment"
    },
    "id": "acc_ear_slave",
    "itemType": "equipment",
    "linkStatus": "resolved",
    "name": "奴隸耳環"
  },
  {
    "dataStatus": "complete",
    "entityRef": {
      "entityId": "acc_ear_tolerance",
      "entityType": "equipment"
    },
    "id": "acc_ear_tolerance",
    "itemType": "equipment",
    "linkStatus": "resolved",
    "name": "寬容耳環"
  },
  {
    "dataStatus": "complete",
    "entityRef": {
      "entityId": "acc_ear_truth",
      "entityType": "equipment"
    },
    "id": "acc_ear_truth",
    "itemType": "equipment",
    "linkStatus": "resolved",
    "name": "真實耳環"
  },
  {
    "dataStatus": "complete",
    "entityRef": {
      "entityId": "acc_ear_twin",
      "entityType": "equipment"
    },
    "id": "acc_ear_twin",
    "itemType": "equipment",
    "linkStatus": "resolved",
    "name": "雙子耳環"
  },
  {
    "dataStatus": "complete",
    "entityRef": {
      "entityId": "acc_ear_undead",
      "entityType": "equipment"
    },
    "id": "acc_ear_undead",
    "itemType": "equipment",
    "linkStatus": "resolved",
    "name": "不死耳環"
  },
  {
    "dataStatus": "complete",
    "entityRef": {
      "entityId": "acc_ear_wisdom",
      "entityType": "equipment"
    },
    "id": "acc_ear_wisdom",
    "itemType": "equipment",
    "linkStatus": "resolved",
    "name": "智慧耳環"
  },
  {
    "dataStatus": "complete",
    "entityRef": {
      "entityId": "acc_icequeen_ear_0",
      "entityType": "equipment"
    },
    "id": "acc_icequeen_ear_0",
    "itemType": "equipment",
    "linkStatus": "resolved",
    "name": "冰之女王的耳環 Lv0"
  },
  {
    "dataStatus": "complete",
    "entityRef": {
      "entityId": "acc_icequeen_ear_1",
      "entityType": "equipment"
    },
    "id": "acc_icequeen_ear_1",
    "itemType": "equipment",
    "linkStatus": "resolved",
    "name": "冰之女王的耳環 Lv1"
  },
  {
    "dataStatus": "complete",
    "entityRef": {
      "entityId": "acc_icequeen_ear_2",
      "entityType": "equipment"
    },
    "id": "acc_icequeen_ear_2",
    "itemType": "equipment",
    "linkStatus": "resolved",
    "name": "冰之女王的耳環 Lv2"
  },
  {
    "dataStatus": "complete",
    "entityRef": {
      "entityId": "acc_icequeen_ear_3",
      "entityType": "equipment"
    },
    "id": "acc_icequeen_ear_3",
    "itemType": "equipment",
    "linkStatus": "resolved",
    "name": "冰之女王的耳環 Lv3"
  },
  {
    "dataStatus": "complete",
    "entityRef": {
      "entityId": "acc_icequeen_ear_4",
      "entityType": "equipment"
    },
    "id": "acc_icequeen_ear_4",
    "itemType": "equipment",
    "linkStatus": "resolved",
    "name": "冰之女王的耳環 Lv4"
  },
  {
    "dataStatus": "complete",
    "entityRef": {
      "entityId": "acc_icequeen_ear_5",
      "entityType": "equipment"
    },
    "id": "acc_icequeen_ear_5",
    "itemType": "equipment",
    "linkStatus": "resolved",
    "name": "冰之女王的耳環 Lv5"
  },
  {
    "dataStatus": "complete",
    "entityRef": {
      "entityId": "acc_icequeen_ear_6",
      "entityType": "equipment"
    },
    "id": "acc_icequeen_ear_6",
    "itemType": "equipment",
    "linkStatus": "resolved",
    "name": "冰之女王的耳環 Lv6"
  },
  {
    "dataStatus": "complete",
    "entityRef": {
      "entityId": "acc_icequeen_ear_7",
      "entityType": "equipment"
    },
    "id": "acc_icequeen_ear_7",
    "itemType": "equipment",
    "linkStatus": "resolved",
    "name": "冰之女王的耳環 Lv7"
  },
  {
    "dataStatus": "complete",
    "entityRef": {
      "entityId": "acc_icequeen_ear_8_cha",
      "entityType": "equipment"
    },
    "id": "acc_icequeen_ear_8_cha",
    "itemType": "equipment",
    "linkStatus": "resolved",
    "name": "冰之女王的耳環 Lv8 魅力"
  },
  {
    "dataStatus": "complete",
    "entityRef": {
      "entityId": "acc_icequeen_ear_8_con",
      "entityType": "equipment"
    },
    "id": "acc_icequeen_ear_8_con",
    "itemType": "equipment",
    "linkStatus": "resolved",
    "name": "冰之女王的耳環 Lv8 體質"
  },
  {
    "dataStatus": "complete",
    "entityRef": {
      "entityId": "acc_icequeen_ear_8_dex",
      "entityType": "equipment"
    },
    "id": "acc_icequeen_ear_8_dex",
    "itemType": "equipment",
    "linkStatus": "resolved",
    "name": "冰之女王的耳環 Lv8 敏捷"
  },
  {
    "dataStatus": "complete",
    "entityRef": {
      "entityId": "acc_icequeen_ear_8_int",